{"schema_version":"rmo-quicklook-synthetic-request-draft-0.1.0","request_id":"B01_contact","purpose":"synthetic_initial_value","execution_mode":"preflight_only","physics":{"model":"ideal_mhd_1d","gamma":1.6666666666666667,"mu0_normalized":1},"normalization":{"rho0":1,"v0":1,"B0":1,"p0":1,"source_units":"synthetic_normalized"},"geometry":{"source_frame":"RIEMANN_COMPUTATIONAL","solver_frame":"RIEMANN_COMPUTATIONAL","normal":[1,0,0],"t1":[0,1,0],"t2":[0,0,1],"galilean_offset":[0,0,0],"handedness":"right"},"shared_Bn":0.75,"initial_states":{"left":{"rho":1.0,"p":1.0,"u":[0.2,0.1,-0.2],"B_t":[0.5,0.25],"id":"X_L0","role":"initial_left","frame":"RIEMANN_COMPUTATIONAL","units":"normalized_mu0_1"},"right":{"rho":0.5,"p":1.0,"u":[0.2,0.1,-0.2],"B_t":[0.5,0.25],"id":"X_R0","role":"initial_right","frame":"RIEMANN_COMPUTATIONAL","units":"normalized_mu0_1"}},"policies":["REGULAR_EVOLUTIONARY_1.0","ENUMERATE_NONREGULAR_1.0"],"uncertainty":{"mode":"exact_synthetic"},"missing_reasons":{}}
